:ID,:LABEL,id,name,category,def
KW-0205,Keyword,KW-0205,Cytosine metabolism,Biological process,Protein involved in the biochemical reactions with the pyrimidine basecytosine
KW-0206,Keyword,KW-0206,Cytoskeleton,Cellular component,"Protein which is a component or which is associated with thecytoskeleton, a dynamic three-dimensional structure that fills thecytoplasm of eukaryotic cells. The cytoskeleton is both a muscle and askeleton, and is responsible for cell movement, cytokinesis, and theorganization of the organelles within the cell. The major componentsof cytoskeleton are the microfilaments (of actin), microtubules (oftubulin) and intermediate filament systems in cells"
KW-0208,Keyword,KW-0208,D-amino acid,PTM,"Protein which contains at least one D-amino acid. All of the aminoacids derived from natural proteins are of the L configuration. D-amino acids are found in nature, especially as components of certainpeptide antibiotics and in walls of certain microorganisms"
KW-0209,Keyword,KW-0209,Deafness,Disease,"Protein which, if defective, causes a partial or total inability tohear. The two principal types of deafness are conductive deafness thatresults from changes in the middle ear, and nerve or sensorineuraldeafness that is caused by damages to the inner ear, the nervepathways to the brain, or the area of the brain that receives soundinformation"
KW-0210,Keyword,KW-0210,Decarboxylase,Molecular function,"Enzyme that belongs to the lyase family and which catalyzes thespliting of CO(2) from the carboxylic group of amino acids, beta-ketoacids and alpha-keto acids"
KW-1132,Keyword,KW-1132,Decay of host mRNAs by virus,Biological process,Viral protein involved in the degradation of host mRNAs. Viruses haveevolved ways of degrading host mRNAs to inhibit cellular translationThis global inhibition of cellular protein synthesis serves to ensuremaximal viral gene expression and to evade host immune response. Decayof host mRNAs can be achieved by endonucleotic RNA cleavage orassociated with PABPC1 nuclear relocalization
KW-0211,Keyword,KW-0211,Defensin,Molecular function,"Families of microbicidal and cytotoxic peptides. Defensins haveantibacterial, antifungal and antiviral properties. Defensins killscells by forming voltage-regulated multimeric channels in thesusceptible cell's membrane"
KW-1238,Keyword,KW-1238,Degradation of host capsule during virus entry,Biological process,"Virion protein involved in breaking down host cell capsule to reachthe host cell wall, and finally the host cytoplasmic membrane. Manyprokaryotic viruses carry for example glycanase, polysaccharide lyaseor deacetylase activities to specifically digest host capsule"
KW-1235,Keyword,KW-1235,Degradation of host cell envelope components during virus entry,Biological process,"Virion protein involved in breaking down host cell surface componentsto reach the host cytoplasmic membrane. Many prokaryotic viruses forexample carry enzymatic activities to degrade the host celllipopolysaccharide layer, cell wall, or capsule"
KW-1247,Keyword,KW-1247,Degradation of host chromosome by virus,Biological process,Viral protein that rapidly degrades the host DNA at the onset ofinfection. The breakdown products can be reused to synthesize viralDNA or can be excreted from the host cell. Degrading host chromosomeprovides an advantage during the virus life cycle by reducing oreliminating competing host macromolecular synthesis. Bacteriophagessuch as T4 or T5 for example are known to induce degradation of thehost chromosome and excretion of the host DNA degradation products
KW-1237,Keyword,KW-1237,Degradation of host lipopolysaccharides during virus entry,Biological process,Virion protein involved in breaking down host cell lipopolysaccharides(LPS) to reach the cytoplasmic membrane of prokaryotes with 2membranes. Many prokaryotic viruses carry glycanase or deacetylaseactivities to digest host LPS
KW-1236,Keyword,KW-1236,Degradation of host peptidoglycans during virus entry,Biological process,"Virion exolysin involved in breaking down host cell peptidoglycans(e.g. murein, pseudomurein) to reach the host cytoplasmic membraneduring virus entry. Exolysins are usually part of the tail or the baseplate of prokaryotic viruses. Exolysins can display various enzymaticactivities such as lysozyme, transglycosylase, muramidase or evenprotease activity. Murein hydrolases for example are widespread inbacteriophages infecting Gram-positive or Gram-negative bacteria"
KW-0213,Keyword,KW-0213,Dejerine-Sottas syndrome,Disease,"Protein which, if defective, causes Dejerine-Sottas disease. DSS is ahereditary motor and sensory neuropathy (HMSN) of the Charcot-Marie-Tooth disease type 1 class. DSS is characterized by severe earlyonset, very slow nerve conduction velocities (less than 12m/sec) andraised cerebrospinal fluid protein concentrations (0.7 g/l). Clinicalsigns are delayed age of walking as well as areflexia"
KW-0214,Keyword,KW-0214,Dental caries,Disease,"Protein involved in dental caries or important in the prevention ofdental caries. Dental caries are localized destruction of the toothsurface, initiated by decalcification of the enamel and followed byenzymatic lysis of organic structures, the result of which is cavityformation. The cavity may penetrate the enamel and dentin, and reachthe pulp. The disease may be caused by acids produced by bacteriawhich lead to decalcification, or by microorganisms that destroy theenamel protein, or by keratolytic microorganisms producing chelatesthat lead to decalcification"
KW-0215,Keyword,KW-0215,Deoxyribonucleotide synthesis,Biological process,"Protein involved in the synthesis of deoxyribonucleotides, the basicrepeating units in DNA. Deoxyribonucleotides consist of a purine or apyrimidine base bonded to deoxyribose, which in turn is bound to aphosphate group. They are synthesised by reduction of ribonucleosidediphosphates"
KW-1061,Keyword,KW-1061,Dermonecrotic toxin,Molecular function,Protein involved in the necrosis of the skin
KW-0911,Keyword,KW-0911,Desmin-related myopathy,Disease,"Protein which, if defective, causes desmin-related myopathy (DRM), aclinically and genetically heterogeneous group of muscular disordersdefined morphologically by intrasarcoplasmic aggregates of desmin,usually accompanied by other protein aggregates. Both autosomaldominant and autosomal recessive inheritance have been reportedApproximately one-third of DRMs are thought to be caused by mutationsin the desmin gene"
KW-0216,Keyword,KW-0216,Detoxification,Biological process,"Protein involved in degrading toxic compounds. Detoxificationgenerally takes place in the liver or kidney and inactivates toxins,either by degradation or by conjugation of residues to a hydrophilicmoiety in order to promote excretion"
KW-0217,Keyword,KW-0217,Developmental protein,Molecular function,"Protein involved in development, the process whereby a multicellularorganism develops from its early immature forms, e.g., zygote, larva,embryo, into an adult"
KW-0218,Keyword,KW-0218,Diabetes insipidus,Disease,"Protein which, if defective, causes diabetes insipidus, a rare form ofdiabetes in which the kidney tubules do not reabsorb enough waterresulting in excessive urine excretion (polyuria). Two types ofdiabetes insipidus are recognized: central or neurohypophysealdiabetes insipidus which is due to defects in the neurohypophysealsystem and results in a deficient quantity of anti-diuretic hormonebeing produced or released; nephrogenic diabetes insipidus, avasopressin unresponsive condition of polyuria and hyposthenuria"
KW-0219,Keyword,KW-0219,Diabetes mellitus,Disease,"Protein which, if defective, causes diabetes mellitus, a disorder ofimpaired carbohydrate, protein, and fat metabolism due to insufficientsecretion of insulin or to target tissue insulin resistance. Diabetesmellitus can be divided into two main types, type I or insulin-dependent diabetes mellitus (IDDM), and type II, or non insulin-dependent diabetes mellitus (NIDDM). Type I diabetes mellitus normallystarts in childhood or adolescence and is caused by the body's ownimmune system which destroys the insulin-producing beta cells in thepancreas. Classical features are polydipsia, polyphagia and polyuria,due to hyperglycemia-induced osmotic diuresis. Type II diabetesmellitus normally starts in adulthood and is caused by a lack ofsensitivity to the body's own insulin. It is usually characterized bya gradual onset with minimal or no symptoms of metabolic disturbanceBoth forms of diabetes mellitus lead to secondary complications(notably cardiovascular, nephropathy, retinopathy, neuropathy). Twoother major subcategories of diabetes mellitus are gestationaldiabetes and diabetes secondary to other medical conditions. In commonusage, the term diabetes, when used alone, refers to diabetes mellitusand not diabetes insipidus"
KW-0220,Keyword,KW-0220,Diaminopimelate biosynthesis,Biological process,"Protein involved in the synthesis of diaminopimelate, the ionic formof the amino acid diaminopimelic acid (DAP) which is found in themurein peptidoglycans of bacterial cell walls. Diaminopimelic acid issynthesised from aspartate"
KW-1024,Keyword,KW-1024,Diamond-Blackfan anemia,Disease,"Protein which, if defective, causes Diamond-Blackfan anemia, a rarecongenital non-regenerative hypoplastic anemia that usually presentsearly in infancy. The disease is characterized by a moderate to severemacrocytic anemia, erythroblastopenia, and an increased risk ofdeveloping leukemia. 30 to 40% of Diamond-Blackfan anemia patientspresent with short stature and congenital anomalies, the most frequentbeing craniofacial (Pierre-Robin syndrome and cleft palate), thumb andurogenital anomalies"
KW-0221,Keyword,KW-0221,Differentiation,Biological process,"Protein involved in differentiation, the developmental process of amulticellular organism by which cells become specialized forparticular functions. Differentiation requires selective expression ofthe genome; the fully differentiated state may be preceded by a stagein which the cell is already programmed for differentiation but is notyet expressing the characteristic phenotype determination. Also usedfor fungal conidiation proteins, and for some bacteria that presentspecialization of function in cell types, such as Caulobactercrescentus"
KW-0222,Keyword,KW-0222,Digestion,Biological process,"Protein involved in the process whereby nutrients are rendered solubleand capable of being absorbed by the organism or cell, by action ofvarious hydrolytic enzymes that break down proteins, carbohydrates,fats, etc"
KW-0223,Keyword,KW-0223,Dioxygenase,Molecular function,Enzyme that reduces molecular oxygen by incorporating both atoms intoits substrate(s)
KW-0224,Keyword,KW-0224,Dipeptidase,Molecular function,Enzyme that hydrolyzes a dipeptide into its constituent amino acids
KW-0903,Keyword,KW-0903,Direct protein sequencing,Technical term,"Protein, whose amino acid sequence has been partially (more than oneresidue) or completely determined experimentally by Edman degradationor by mass spectrometry"
KW-0225,Keyword,KW-0225,Disease mutation,Disease,"Protein for which at least one variant, responsible for a disease, isdescribed in the feature table of its Swiss-Prot entry"
KW-1015,Keyword,KW-1015,Disulfide bond,PTM,"Protein which is modified by the formation of a bond between the thiolgroups of two peptidyl-cysteine residues. The process of chemicaloxidation that forms interchain disulfide bonds can produce stable,covalently linked protein dimers, multimers or complexes, whereasintrachain disulfide bonds can contribute to protein folding andstability. Depending on the protein environment, some disulfide bondsare more labile, forming transient redox-active disulfide bonds thatare alternately reduced and oxidized in the course of an enzymaticreaction"
KW-0226,Keyword,KW-0226,DNA condensation,Biological process,"Protein involved in DNA condensation. In most eukaryotes, thechromosomal packing involves the wrapping of DNA around a core ofhistones to form nucleosomes. Adjacent nucleosomes are packagedtogether via Histone 1 and nucleosomes are organised into a 30 nmchromatin fibre. DNA condensation takes place as cells enter mitosisor when germ cells enter meiosis"
KW-0227,Keyword,KW-0227,DNA damage,Biological process,"Protein induced by DNA damage or protein involved in the response toDNA damage. Drug- or radiation-induced injuries in DNA introducedeviations from its normal double-helical conformation. These changesinclude structural distortions which interfere with replication andtranscription, as well as point mutations which disrupt base pairs andexert damaging effects on future generations through changes in DNAsequence. Response to DNA damage results in either repair ortolerance"
KW-1256,Keyword,KW-1256,DNA end degradation evasion by virus,Biological process,"Viral protein that inhibits or counteracts prokaryotic hosthelicase/nuclease proteins in order to escape the antiviral activityof the latter. When functioning in their exonuclease mode,helicase/nuclease proteins such as bacterial RecBCD or AddAB degradeany free DNA end as well as the linear dsDNA products resulting fromrestriction Type II cleavage. Any prokaryotic virus that exposes freedsDNA ends as part of its life cycle must find the means to evadedestruction by these host enzymes. Prokaryotic viruses escape thishost defense by expressing inhibitors or by protecting the ends oftheir linear genomes from digestion"
KW-0228,Keyword,KW-0228,DNA excision,Biological process,"Protein involved in the repair of damages to one strand of DNA (lossof purines due to thermal fluctuations, formation of pyrimidine dimersby UV irradiation, for instance). The site of damage is recognized,excised by an endonuclease, the correct sequence is copied from thecomplementary strand by a polymerase and the ends of this correctsequence are joined to the rest of the strand by a ligase. Inbacterial systems, the polymerase also acts as endonuclease. ExcisaseA and other proteins involved in recombination mediate DNA excision; aprocess whereby abnormal or mismatched nucleotides are enzymaticallycut out of a strand of a DNA molecule"
KW-0229,Keyword,KW-0229,DNA integration,Biological process,"Protein involved in DNA integration, a process that mediates theinsertion of foreign genetic material, or other duplex DNA, into achromosome, or another replicon, in order to form a covalently linkedDNA continuous with the host DNA"
KW-0230,Keyword,KW-0230,DNA invertase,Molecular function,Specific recombinases which catalyze the inversion of a DNA segmentwithin a nucleoprotein structure termed invertasome
KW-0233,Keyword,KW-0233,DNA recombination,Biological process,"Protein involved in DNA recombination, i.e. any process in which DNAmolecules are cleaved and the fragments are rejoined to give a newcombination"
KW-0234,Keyword,KW-0234,DNA repair,Biological process,"Protein involved in the repair of DNA, the various biochemicalprocesses by which damaged DNA can be restored. DNA repair embraces,for instance, not only the direct reversal of some types of damage(such as the enzymatic photoreactivation of thymine dimers), but alsomultiple distinct mechanisms for excising damaged base; termednucleotide excision repair (NER), base excision repair (BER) andmismatch repair (MMR); or mechanisms for repairing double-strandbreaks"
KW-0235,Keyword,KW-0235,DNA replication,Biological process,"Protein involved in DNA replication, i.e. the duplication of DNA bymaking a new copy of an existing molecule. The parental double-stranded DNA molecule is replicated semi conservatively, i.e. eachcopy contains one of the original strands paired with a newlysynthesized strand that is complementary in terms of AT and GC basepairing"
KW-0236,Keyword,KW-0236,DNA replication inhibitor,Molecular function,Protein involved in the inhibition of DNA replication
KW-0237,Keyword,KW-0237,DNA synthesis,Biological process,Protein involved in the synthesis of DNA from deoxyribonucleic acidmonomers
KW-0238,Keyword,KW-0238,DNA-binding,Molecular function,"Protein which binds to DNA, typically to pack or modify the DNA, or toregulate gene expression. Among those proteins that recognize specificDNA sequences, there are a number of characteristic conserved motifsbelieved to be essential for specificity. Many DNA-binding domains aredescribed in PROSITE"
KW-0239,Keyword,KW-0239,DNA-directed DNA polymerase,Molecular function,Enzyme that catalyzes DNA synthesis by addition of deoxyribonucleotideunits to a DNA chain using DNA as a template. They can also possessexonuclease activity and therefore function in DNA repair
KW-0240,Keyword,KW-0240,DNA-directed RNA polymerase,Cellular component,"Protein of the DNA-directed RNA polymerase complexes, which catalyzeRNA synthesis the by addition of ribonucleotide units to a RNA chainusing DNA as a template. They can initiate a chain de novoProkaryotes have a single enzyme for the three RNA types that issubject to stringent regulatory mechanisms. Eukaryotes have type Ithat synthesizes all rRNA except the 5S component, type II thatsynthesizes mRNA and hnRNA and type III that synthesizes tRNA and the5S component of rRNA"
KW-0241,Keyword,KW-0241,Down syndrome,Disease,"Protein which, if defective, causes Down's syndrome, a condition dueto the presence of three copies of chromosome 21 (trisomy 21),characterized by some degree of mental retardation, short stature andpoor muscle tone. Common (1 in 700 live births); incidence increaseswith maternal age. The cause is usually non-disjunction at meiosis butoccasionally a translocation of fused chromosomes 21 and 14"
KW-0242,Keyword,KW-0242,Dwarfism,Disease,"Protein which, if defective, causes dwarfism, a skeletal growth defectresulting in the condition of being undersized"
KW-0243,Keyword,KW-0243,Dynein,Cellular component,"Large multimeric complex with ATPase activity, responsible for themovement of eukaryotic cilia and flagella (axonemal dynein) and forthe intracellular retrograde motility of vesicles, organelles andchromosomes along microtubules (cytosolic dynein). Constitutes theside arms of the outer microtubule doublets in the ciliary axoneme andis responsible for the sliding. Also used for the dynein-associatedmicrotubule-binding proteins (MTBs), e.g. dynactin"
KW-1011,Keyword,KW-1011,Dyskeratosis congenita,Disease,"Protein which, if defective, causes dyskeratosis congenita, aclinically and genetically heterogeneous disorder characterized byabnormal skin pigmentation, mucosal leukoplakia, nail dystrophy,progressive bone marrow failure, and increased predisposition tocancer"
KW-1023,Keyword,KW-1023,Dystonia,Disease,"Protein which, if defective, causes dystonia or dystonic conditionsthat feature persistent or recurrent episodes of dystonia as a majormanifestation of disease. Dystonia is a movement disorder with aneurological basis, due to disordered tonicity of muscle. It ischaracterized by sustained involuntary muscle contractions that causeabnormal postures, twisting, repetitive and patterned movements. Itmay affect muscles throughout the body (generalized), in certain partsof the body (segmental), or may be confined to particular muscles ormuscle groups (focal)"
KW-1215,Keyword,KW-1215,Dystroglycanopathy,Disease,"Protein which, if defective, causes any of the muscular disorderscaused by aberrant glycosylation of dystroglycan. These geneticallyheterogeneous diseases include a range of conditions with differentdegrees of severity. At the most severe end of the clinical spectrum,Walker-Warburg syndrome (WWS), muscle-eye-brain disease (MEB) andFukuyama congenital muscular dystrophy (FCMD) are characterized bycongenital muscular dystrophy and severe structural brain and eyeabnormalities, which in WWS result in early infantile death. At themildest end of the clinical spectrum, affected individuals presentwith limb girdle muscular dystrophy (LGMD), without brain and eyeinvolvement"
KW-0244,Keyword,KW-0244,Early protein,Developmental stage,Bacteriophage or viral protein expressed in the first phase of theinfectious cycle
KW-0038,Keyword,KW-0038,Ectodermal dysplasia,Disease,"Protein which, if defective, causes ectodermal dysplasia, aheterogeneous group of developmental disorders affecting tissues ofectodermal origin. Ectodermal dysplasias are characterized by abnormaldevelopment of two or more ectodermal structures such as hair, teeth,nails and sweat glands, with or without any additional clinical signEach combination of clinical features represents a different type ofectodermal dysplasia"
KW-0245,Keyword,KW-0245,EGF-like domain,Domain,"Protein containing at least one EGF-like domain, a sequence of aboutthirty to forty amino-acid residues long found in the sequence ofepidermal growth factor (EGF). It has been shown to be present, in amore or less conserved form, in a large number of proteins. The EGF-like domain contains six cysteines which form disulfide bonds withinthe domain (C1-C3, C2-C4, C5-C6)"
KW-0248,Keyword,KW-0248,Ehlers-Danlos syndrome,Disease,"Protein which, if defective, causes Ehlers-Danlos syndrome (EDS), agenetically and phenotypically heterogeneous group of connective-tissue disorders. It affects primarily the skin, ligaments, joints,and blood vessels. Typical features include skin hyperextensibility,joint hypermobility, easy bruisability, friability of tissues withbleeding and poor wound healing. Inheritance can be autosomaldominant, autosomal recessive, or X-linked recessive"
KW-0249,Keyword,KW-0249,Electron transport,Biological process,"Protein involved in the transport of electrons, a process by whichelectrons are transported through a series of reactions from thereductant, or electron donor, to the oxidant, or electron acceptor,with concomitant energy conversion. Necessary for both photosynthesisand aerobic respiration"
KW-0250,Keyword,KW-0250,Elliptocytosis,Disease,"Protein which, if defective, causes elliptocytosis, a disordercharacterized by variable haemolytic anaemia and elliptical red bloodcell shape. Caused by deficiency/dysfunction of red blood cellmembrane proteins"
KW-0251,Keyword,KW-0251,Elongation factor,Molecular function,"Protein that associates with ribosomes cyclically during theelongation phase of protein synthesis, and catalyze formation of theacyl bond between the incoming amino-acid residue and the peptidechain"
KW-1067,Keyword,KW-1067,Emery-Dreifuss muscular dystrophy,Disease,"Protein which, if defective, causes Emery-Dreifuss muscular dystrophy,a heterogenous group of inherited muscular dystrophy without theinvolvement of nervous system. The disease is characterized by slowlyprogressive muscle weakness, contracture of the elbows, Achillestendon and posterior cervical muscles, and cardiac features"
KW-0254,Keyword,KW-0254,Endocytosis,Biological process,"Protein involved in endocytosis, a process by which extracellularmaterials are taken up into a cell by invagination of the plasmamembrane to form vesicles enclosing these materials"
KW-0255,Keyword,KW-0255,Endonuclease,Molecular function,Phosphodiesterase capable of cleaving at phosphodiester internal bondswithin a DNA or RNA substrate
KW-0256,Keyword,KW-0256,Endoplasmic reticulum,Cellular component,"Protein whose subcellular location is the endoplasmic reticulum, amembrane system continuous with the outer nuclear membrane. Itconsists of flattened, single-membrane vesicles whose innercompartments, the cisternae, interconnect to form channels throughoutthe cytoplasm. The rough-surface portion is studded with ribosomes"
KW-0257,Keyword,KW-0257,Endorphin,Molecular function,Morphine-like peptides produced by the brain in response toneurotransmitters. They bind to neuron receptors that mediate theaction of opiates and induce analgesia and sedation
KW-0967,Keyword,KW-0967,Endosome,Cellular component,"Protein found in or associated with endosomes. Endosomes are highlydynamic membrane systems involved in transport within the cell, theyreceive endocytosed cell membrane molecules and sort them for eitherdegradation or recycling back to the cell surface. They also receivenewly synthesised proteins destined for vacuolar/lysosomalcompartments. In certain cell types, endosomal multivesicular bodiesmay fuse with the cell surface in an exocytic manner. These releasedvesicles are called exosomes"
KW-0259,Keyword,KW-0259,Enterobactin biosynthesis,Biological process,"Protein involved in the synthesis of enterobactin, a compound thattransports iron from the bacterial environment into the cellcytoplasm"
KW-0260,Keyword,KW-0260,Enterotoxin,Molecular function,"Toxin which, either when ingested or when produced by enterobacteriawithin the intestine, acts on the intestinal mucosa and inducesdiarrhea by perturbing ion and water transport systems"
