:ID,:LABEL,id,name,category,def
KW-1086,Keyword,KW-1086,Inhibition of host chemokines by virus,Biological process,"Viral protein involved in the evasion of host immune response byinhibiting chemokines. Chemokines have several roles including Th1/Th2differentiation, T_cell costimulation, or promotion of leukocytemigration. Due to the importance of chemokines in immunity, viruseshave evolved mechanisms to counter the chemokine network. They encodechemokine-like proteins, chemokine receptors, or chemokine-bindingproteins to inhibit cellular chemokines"
KW-1087,Keyword,KW-1087,Inhibition of host complement factors by virus,Biological process,"Viral protein involved in the evasion of host humoral response byinhibiting the complement factors. The activation of complementinvolves the sequential proteolyis of proteins to generate enzymeswith catalytic activities. The biological functions of the complementinclude opsonization, inflammation, lysis of immune complexes, orenhancement of the humoral immune response. Some herpesviruses,poxviruses and retroviruses mimic or interact with complementregulatory proteins to block complement activation and neutralizationof virus particles"
KW-1248,Keyword,KW-1248,Inhibition of host DNA replication by virus,Biological process,Viral protein that blocks host DNA replication without inhibiting hosttranscription or translation. Inhibiting host replication provides anadvantage during the virus life cycle by reducing or eliminatingcompeting host macromolecular synthesis. Bacteriophage N4 for exampleis known to shut off the host DNA replication while the host genomeremains structurally intact. Bacteriophage lambda prevents host DNAreplication initiation and Staphylococcus bacteriophages target thereplicative DNA polymerase processivity clamp and the helicase
KW-1224,Keyword,KW-1224,Inhibition of host IKBKE by virus,Biological process,"Viral protein involved in the evasion of host innate defenses byinhibiting the IKBKE/IKK-epsilon kinase. Upon viral infection, theDDX58/RIG-I or IFIH1/MDA5 receptors recognize foreign material andtransmit the signal to downstream components MAVS and IKBKE. In turn,the IKBKE kinase phosphorylates and activates IRF3 and/or IRF7. Oncephosphorylated, IRF3 and IRF7 translocate into the nucleus to drivetranscription of interferons. Several viruses including arenavirusesor ebola virus interact directly with and inhibit IKBKE/IKK-epsilon toprevent IRFs activation"
KW-1090,Keyword,KW-1090,Inhibition of host innate immune response by virus,Biological process,"Viral protein involved in the evasion of host innate immune responseUpon viral infection, the innate immune system initially defends thehost in a non-specific manner. Many viral proteins interact with andinhibit components the host innate system to replicate moreefficiently"
KW-1091,Keyword,KW-1091,Inhibition of host interferon receptors by virus,Biological process,"Viral protein involved in the evasion of the interferon pathway byinhibiting interferon receptors. Interferon signaling exerts antiviraleffects through cell surface receptors termed interferon receptors. Inresponse to binding of extracellular interferons, they activate theJAK/STAT pathway causing transcriptional activation of IFN-regulatedgenes. To avoid this antiviral response, several viruses target theinterferon receptors and send them to degradation via the proteasome"
KW-1114,Keyword,KW-1114,Inhibition of host interferon signaling pathway by virus,Biological process,Viral protein involved in the evasion of host innate defense byinhibiting the interferon signaling pathway leading to the productionof interferon-induced genes. Interferons bind to the IFN receptors(IFNAR) on the cell surface and activate Jak/Tyk kinases. Thesekinases phosphorylate STAT1 and STAT2 that translocate to the nucleusand induce the expression of interferon stimulated genes (ISGs). Manyviruses interact with components of this pathway to prevent expressionof ISGs and inhibit the host immune response
KW-1092,Keyword,KW-1092,Inhibition of host IRF3 by virus,Biological process,"Viral protein involved in the evasion of host innate defense byinhibiting the interferon regulatory factor-3 (IRF3) protein. Viralinfection triggers the phosphorylation and activation of IRF3. Theactivated IRF3 migrates to the nucleus, where it complexes with thetranscription coactivator CREBBP/EP300, leading to the transcriptionalactivation of the IFN-alpha and IFN-beta genes. Several viral proteinsdirectly bind to IRF3 and inhibit its transcriptional activity whileothers target it to the proteasome for degradation"
KW-1093,Keyword,KW-1093,Inhibition of host IRF7 by virus,Biological process,Viral protein involved in the evasion of host innate defense byinhibiting the interferon regulatory factor-7 (IRF7) protein. Viralinfection triggers the phosphorylation and activation of IRF7. Theactivated IRF7 migrates to the nucleus leading to the transcriptionalactivation of the IFN-alpha and IFN-beta genes. Some viral proteinsprevent IRF7 phosphorylation and nuclear activation. Ebola virus VP35interacts with IRF7 and hijacks the cellular SUMOylation machinery forits advantage to increase IRF7 SUMOylation thereby disabling itsactivity
KW-1094,Keyword,KW-1094,Inhibition of host IRF9 by virus,Biological process,Viral protein involved in the evasion of the type I and III interferonpathway by inhibiting the interferon regulatory factor-9 (IRF9)protein. Viral infection triggers the phosphorylation and activationof IRF9. The activated IRF9 migrates to the nucleus leading to thetranscriptional activation of several hundred IFN-responsive genesSome viral proteins inhibit IRF9 activation by preventing its nuclearlocalization upon infection or by sending it to the nucleus in aninactive state
KW-1095,Keyword,KW-1095,Inhibition of host ISG15 by virus,Biological process,"Viral protein involved in the evasion of host immune defense byinhibiting the ISG15 protein, an ubiquitin-like modifier playingimportant roles in the innate immune response. Like ubiquitin, ISG15is conjugated to lysines on numerous target proteins through itsconserved C-terminal region. Viruses escape from the antiviralactivity of ISG15 by direct interaction or by cleavage of ISG15derivatives"
KW-1096,Keyword,KW-1096,Inhibition of host JAK1 by virus,Biological process,"Viral protein involved in the evasion of the type I, II and IIIinterferon pathways by inhibiting the JAK1 protein. Upon viralinfection, JAK1 is activated by the interferon-alpha/beta, -gamma, and-lambda signal transduction pathways. Several viral proteins candirectly interact with JAK1 to prevent its ability to phosphorylatethe downstream partners STAT1 or STAT2"
KW-1097,Keyword,KW-1097,Inhibition of host MAVS by virus,Biological process,"Viral protein involved in the evasion of host innate defense byinhibiting the MAVS protein. During viral replication, dsRNA isproduced and detected by DDX58/RIG-I or IFIH1/MDA5 that will activateMAVS to coordinate pathways leading to induction of antiviralcytokines. Several viral proteins including NS3/4A from Hepatitis C,or protease 3C from hepatitis A virus, cleave MAVS to abrogate itsactivity"
KW-1089,Keyword,KW-1089,Inhibition of host MDA5 by virus,Biological process,"Viral protein involved in the evasion of host innate defense byinhibiting the IFIH1/MDA5 protein. Upon recognition of long viraldsRNAs, IFIH1/MDA5 initiates an antiviral signaling cascade byinteracting with downstream partners. Some viral proteins includingparamyxovirus V proteins interact with IFIH1/MDA5 and blocks itsbinding with its downstream partner MAVS"
KW-1115,Keyword,KW-1115,Inhibition of host MHC class I molecule presentation by virus,Biological process,Viral protein involved in the evasion of host adaptive immune responseby inhibiting the presentation of loaded MHC class I molecules at thecell surface. Many viruses 'intercept' the loaded MHC class Imolecules and retain them in the endoplasmic reticulum or target themto degradation in order to prevent presentation of the peptides at thecell surface
KW-1116,Keyword,KW-1116,Inhibition of host MHC class II molecule presentation by virus,Biological process,"Viral protein involved in the evasion of host adaptive immune responseby inhibiting the presentation of loaded MHC class II molecules at thecell surface. MHC class II molecules are found only on a fewspecialized cells termed professional antigen-presenting cells (APCs)This group includes macrophages, dendritic cells and B-cells. Manyviruses 'intercept' the loaded MHC class II molecules and retain themin the endoplasmic reticulum or target them to degradation in order toprevent presentation of the peptides at the cell surface"
KW-1098,Keyword,KW-1098,Inhibition of host mitotic exit by virus,Biological process,Viral protein involved in the inhibition of host cell cycleprogression by preventing cells to exit mitosis
KW-1099,Keyword,KW-1099,Inhibition of host mRNA nuclear export by virus,Biological process,Viral protein involved in the disruption of the mRNA nuclear exportmachinery. Viruses have evolved ways of interacting with the nuclearexport machinery to inhibit cellular translation and maximize theexpression of their own mRNAs. This global inhibition of cellularprotein synthesis serves to ensure maximal viral gene expression andto evade host immune response
KW-1100,Keyword,KW-1100,Inhibition of host NF-kappa-B by virus,Biological process,"Viral protein involved in the inhibition of host NF-kappa-B. Thisprotein is a pleiotropic transcription factor which is present inalmost all cell types and is involved in many biological processessuch as inflammation, immunity, differentiation, cell growth,tumorigenesis and apoptosis. Many viruses have developed strategies toinhibit the NF-kappa-B pathway in order to evade host immunity andinhibit production of proinflammatory cytokines"
KW-1102,Keyword,KW-1102,Inhibition of host PKR by virus,Biological process,"Viral protein involved in the evasion of the interferon pathway byinhibiting the interferon induced PKR/EIF2AK2 protein. During viralreplication of RNA viruses, dsRNA is produced leading to theactivation of the PKR/EIF2AK2 kinase. Once activated, PKR/EIF2AK2autophosphorylates and catalyzes the phosphorylation of manysubstrates including the translation initiation factor EIF2S1, leadingto the inhibition of the initiation of protein synthesis. Severalviral proteins prevent PKR/EIF2AK2 activation by direct interactionwhile others target PKR/EIF2AK2 to degradation"
KW-1101,Keyword,KW-1101,Inhibition of host poly(A)-binding protein by virus,Biological process,"Viral protein involved in the inhibition of host translation byinhibiting the poly(A)-binding protein PABPC1. Viruses have evolvedways of interacting with the host translational machinery to shutoffhost gene expression. This global inhibition of cellular proteinsynthesis serves to ensure maximal viral gene expression and to evadehost immune response. One common target is the translation initiationfactor PABPC1. Some viruses proteolytically cleave PABPC1, whileothers displace PABPC1 from EIF4G1"
KW-1103,Keyword,KW-1103,Inhibition of host pre-mRNA processing by virus,Biological process,Viral protein involved in the disruption of host pre-mRNA processingViruses have evolved ways of interacting with the cellular RNAsplicing machinery and regulate splicing of cellular pre-mRNAs as apart of the mechanism for shutting down the synthesis of hostproteins. This global inhibition of cellular protein synthesis servesto ensure maximal viral gene expression and to evade host immuneresponse
KW-1117,Keyword,KW-1117,Inhibition of host proteasome antigen processing by virus,Biological process,Viral protein involved in the evasion of host adaptive immune responseby inhibiting MHC class I peptide antigen generation by theproteasome. The processing of foreign proteins leads to thepresentation of viral peptides by MHC class I molecules to cytotoxic Tlymphocytes and triggers immune response. Several viral proteins haveevolved mechanisms to avoid synthesis of antigenic peptide by theproteasome. Epstein-Barr virus EBNA-1 for example contains an internalrepeat exclusively composed of glycines and alanines that inhibits itsproteasomal degradation
KW-1088,Keyword,KW-1088,Inhibition of host RIG-I by virus,Biological process,"Viral protein involved in the evasion of host innate defense byinhibiting the DDX58/RIG-I protein. Upon recognition of viral RNA, thecytosolic receptor DDX58/RIG-I initiates an antiviral signalingcascade by interacting with downstream partners. Several viralproteins inhibit DDX58/RIG-I via direct interaction while others viaproteolytic cleavage"
KW-1113,Keyword,KW-1113,Inhibition of host RLR pathway by virus,Biological process,"Viral protein involved in the evasion of host innate defense byinhibiting the DDX58/RIG-I-like receptor (RLR) pathway leading to thetriggering of interferon-mediated response. This pathway starts withthe recognition of viral RNA by host proteins including DDX58/RIG-I orIFIH1. Then, the signal is transmitted through MAVS and TRAFs leadingto the activation and nuclear localization of transcription factorsIRF3 and IRF7 to induce IFNalpha/beta transcription and proteinproduction. Many viruses interact with components of this pathway toinhibit production of interferons and establishment of the antiviralstate"
KW-1104,Keyword,KW-1104,Inhibition of host RNA polymerase II by virus,Biological process,"Viral protein involved in the disruption of the host RNA polymeraseII. Many viruses induce alterations in the cellular gene expressionAmong these, shutoff of host transcription by targeting RNA polymeraseII is commonly used. Indeed, many viruses are able to modify RNAP IICTD including Herpes virus, HIV, Epstein-Barr virus or Bunyamweravirus"
KW-1105,Keyword,KW-1105,Inhibition of host STAT1 by virus,Biological process,"Viral protein involved in the evasion of the type I, II and IIIinterferon pathways by inhibiting the STAT1 protein. Upon viralinfection, STAT1 is activated by IFN-gamma, IFN-alpha/beta, or IFN-lambda that bind to specific cell surface receptors. While IFN-gammainduces STAT1 homodimerization, IFN-alpha/beta and IFN-lambdastimulate heterodimerization of STAT1 and STAT2, both leading to STAT1nuclear localization and subsequent induction of IFN-stimulated genesMany viruses interfere with STAT1 activation, often by preventingSTAT1 phosphorylation and nuclear localization"
KW-1106,Keyword,KW-1106,Inhibition of host STAT2 by virus,Biological process,"Viral protein involved in the evasion of type I and III interferonpathways by inhibiting STAT2 protein. Upon viral infection, STAT2 isactivated by IFN-alpha/beta or IFN-lambda that bind to specific cellsurface receptors. In turn, IFN-alpha/beta (or IFN-lambda) inducesheterodimerization of STAT1 and STAT2 by phosphorylation, leading toSTAT2 nuclear localization and subsequent induction of IFN-stimulatedgenes. Many viruses interfere with STAT2 activation, often bypreventing STAT2 phosphorylation and nuclear localization"
KW-1107,Keyword,KW-1107,Inhibition of host TAP by virus,Biological process,"Viral protein involved in the evasion of host adaptive immune responseby inhibiting the TAP complex. Transporter associated with antigen(TAP), composed of two subunits TAP1 and TAP2, is required for thetranslocation of peptides into the ER, where they are loaded onto MHCclass I. Thereafter, the viral peptides are presented to cytotoxic Tlymphocytes at the cell surface and trigger immune response. Theloading of peptide on MHC by TAP is targeted by several virusesincluding herpesviruses and retroviruses"
KW-1108,Keyword,KW-1108,Inhibition of host tapasin by virus,Biological process,"Viral protein involved in the evasion of host adaptive immune responseby inhibiting the tapasin/TAPBP protein. tapasin/TAPBP is a type Itransmembrane protein essential for the optimal expression of stableMHC class I molecules on host cell surface. Its helps the MHC class Imolecules to remain in a peptide receptive state, avoidingirreversible denaturation. Several retroviruses and DNA viruses encodeproteins interacting with tapasin/TAPBP and inhibiting its activity"
KW-1223,Keyword,KW-1223,Inhibition of host TBK1 by virus,Biological process,"Viral protein involved in the evasion of host innate defenses byinhibiting the TBK1 kinase. Upon viral infection, Toll-like receptors(TLRs) or DNA recognition receptors recognize foreign material andtransmit the signal to TBK1 that in turn phosphorylates and activatesIRF3 and IRF7. Once phosphorylated, IRF3 and/or IRF7 translocate intothe nucleus to drive transcription of interferons. Several virusesincluding herpes simplex virus 1 or vaccinia virus interact directlywith and inhibit TBK1 to prevent IRFs activation"
KW-1084,Keyword,KW-1084,Inhibition of host tetherin by virus,Biological process,"Viral protein involved in the evasion of host immune defense byinhibiting the BST2/tetherin protein. BST2/tetherin is an alphainterferon-inducible cellular factor that impairs the release of manyenveloped viruses, including human immunodeficiency virus type 1 (HIV-1), HIV-2, as well as other retroviruses. Several viruses manage tocircumvent the antiviral activity of BST2/tetherin either by sendingBST2/tetherin to degradation (HIV-1) or by lowering the presence ofBST2 on cell surfaces (HIV-2)"
KW-1225,Keyword,KW-1225,Inhibition of host TLR pathway by virus,Biological process,"Viral protein involved in the evasion of host innate defenses byinhibiting the Toll-like recognition receptor (TLR) pathway. Thispathway usually starts with the recognition of viruses by host TLRsincluding TLR3 or TLR4. Then, the signal is transmitted through MYD88(or TRIF) and then to TBK1 leading to the activation and nuclearlocalization of transcription factors IRF3 and/or IRF7 to induceIFNalpha/beta transcription and production of proinflammatorycytokines through activation of the NF-kappaB signaling pathway. Manyviruses interact with components of this pathway to inhibit productionof interferons and establishment of the antiviral state"
KW-1110,Keyword,KW-1110,Inhibition of host TRAFs by virus,Biological process,"Viral protein involved in the evasion of host innate defense byinhibiting TRAF proteins. After viral infection, the cellularsignaling pathway leading to production of interferons is activatedand several TRAF family members including TRAF2, TRAF3, and TRAF5participate in this cascade. Many viruses encode protein able tointeract with TRAF members to inhibit their antiviral activity"
KW-1112,Keyword,KW-1112,Inhibition of host TYK2 by virus,Biological process,"Viral protein involved in the evasion of the type I and III interferonpathways by inhibiting the host TYK2 protein. Upon viral infection,the TYK2 protein is activated by IFNalpha/beta or IFN-lambdastimulation leading to a series of phosphorylation events that inducetranscription of several hundred IFN-responsive genes. Several viruseshave evolved mechanisms to inhibit TYK2 activity thereby preventingthe subsequent activation of downstream partners STAT1 and STAT2"
KW-0396,Keyword,KW-0396,Initiation factor,Molecular function,Protein which plays an important role in initiating the translation ofa mRNA molecule into a polypeptide. Initiation factors help to formthe complex between the mRNA and a ribosome
KW-0399,Keyword,KW-0399,Innate immunity,Biological process,"Protein involved in innate immunity, an inborn defense mechanism usedby organisms to defend themselves against invasion by pathogens(bacteria, fungi, viruses, etc.). Initially discovered in insectswhich are devoid of an adaptive immune system and rely only on innateimmune reactions for their defense, this immediate responseaccomplishes many activities including recognition and effectorfunctions. Recognition is mediated by broad specificity, patternrecognition, receptors which recognize many related molecularstructures (e.g. polysaccharides, polynucleotides) present inmicroorganisms but not found in the host. The innate responses includethe release of antimicrobial peptides, production of cytokines, acute-phase proteins, complement. Although many different innate immunemechanisms are deployed for host defence, a unifying theme of innateimmunity is the use of germline-encoded pattern recognition receptorsfor pathogens or damaged self components, such as the Toll-likereceptors, nucleotide-binding domain leucine-rich repeat (LRR)-containing receptors, retinoic acid-inducible gene I-like RNAhelicases and C-type lectin receptors"
KW-1153,Keyword,KW-1153,Inner capsid protein,Cellular component,Viral protein that is a component of the inner layer of a double ortriple concentric icosahedral capsid. Inner capsids are part ofreoviridae and cystoviridae virions
KW-0398,Keyword,KW-0398,Inositol biosynthesis,Biological process,"Protein involved in the synthesis of inositol, a cyclic hexahydricalcohol. It occurs in various forms, of which myo-inositol, aconstituent of phospholipids, is the most important"
KW-0978,Keyword,KW-0978,Insecticide resistance,Biological process,"Protein that confers, on insect vectors and pests, the ability towithstand insecticide action. Insecticides are chemicals thatselectively kill insects. Insecticide resistance usually occurs by twobroad mechanisms. The first is where the insect may produce largeamounts of enzymes, such as esterases which either break down theinsecticide molecule or bind to it so tightly that it cannot function(a process known as sequestration). The second mechanism involvesmutation of the insecticide target site, such as theacetylcholinesterase enzyme in the nervous system. This effectivelyblocks the action of the insecticide"
KW-0401,Keyword,KW-0401,Integrin,Molecular function,Protein of the integrin family of cell surface heterodimeric receptorsthat mediates dynamic cell-to-cell as well as cell-to-matrix adhesionIntegrins function as mechanochemical sensors and transducers able tochange rapidly and reversibly their adhesive functions by modulatingtheir ligand-binding affinity. Each subunit has a large N-terminalextracellular domain followed by a transmembrane domain and a short C-terminal cytoplasmic region. Some subclasses of integrins share acommon beta chain while having different alpha chains
KW-0922,Keyword,KW-0922,Interferon antiviral system evasion,Biological process,"Viral protein which prevents the activation of the antiviral stateinduced by interferon (IFN) in the host cell, thereby allowing thevirus to replicate optimally. The antiviral state is the result of asignaling pathway induced by IFN-alpha or IFN-beta following viralinfection. It leads to the transcription of various cellular antiviralgenes coding for host defense proteins"
KW-1154,Keyword,KW-1154,Intermediate capsid protein,Cellular component,Viral protein that is a component of the intermediate layer of atriple concentric icosahedral capsid. Intermediate capsids are part ofreoviridae virions
KW-0403,Keyword,KW-0403,Intermediate filament,Cellular component,"Intermediate filaments (IF) are proteins which are primordialcomponents of the cytoskeleton and the nuclear envelope. Theygenerally form filamentous structures 8 to 14 nm wide and intermediatein size between microtubules and microfilaments. This family ofprotein includes cytokeratins, vimentin, desmin, glial fibrillaryacidic protein, neurofilament proteins and nestin. All IF proteins arestructurally similar in that they consist of: a central rod domainwhich is arranged in coiled-coiled alpha-helices, with at least twoshort characteristic interruptions; an N-terminal non-helical domain(head) of variable length; and an C-terminal domain (tail) which isalso non-helical and shows extreme length variation between differentIF proteins"
KW-0988,Keyword,KW-0988,Intrahepatic cholestasis,Disease,"Protein which, if defective, causes intrahepatic cholestasis, acondition characterized by stoppage or suppression of the bile flowfrom the liver to the duodenum without extrahepatic bile ductobstruction"
KW-0404,Keyword,KW-0404,Intron homing,Biological process,"Endonucleases involved in intron homing, a genetic event leading tothe transfer of an intron DNA sequence. This type of intron mobilitydepends on site-specific restriction endonucleases encoded by themobile introns"
KW-0405,Keyword,KW-0405,Iodination,PTM,Protein which is posttranslationally modified by the replacement of atleast one hydrogen by iodine
KW-0407,Keyword,KW-0407,Ion channel,Molecular function,"Protein which is part of a transmembrane protein complex that forms ahydrophilic channel across the lipid bilayer through which specificinorganic ions can diffuse down their electrochemical gradients. Thechannels are usually gated and only open in response to a specificstimulus, such as a change in membrane potential (voltage-gated) orthe binding of a ligand (ligand-gated channel)"
KW-0872,Keyword,KW-0872,Ion channel impairing toxin,Molecular function,"Protein which interferes with the function of ion channels, which arehydrophilic channels across the lipid bilayer through which specificinorganic ions can diffuse down their electrochemical gradients"
KW-0406,Keyword,KW-0406,Ion transport,Biological process,"Protein involved in the transport of ions. Such proteins are usuallytransmembrane and mediate a movement of ions across cell membranesTransport may be passive (facilitated diffusion; down theelectrochemical gradient), or active (against the electrochemicalgradient). Active transport requires energy which may come from light,oxidation reactions, ATP hydrolysis, or cotransport of other ions ormolecules"
